{
  "schema_version": "1.0",
  "job_id": "job-demo-defect-0004",
  "source_file": "/Users/zz/code/LLM-AutoTest/deploy/golden/requirements.md",
  "items": [
    {
      "id": "REQ-001",
      "title": "用户查询",
      "description": "按用户 ID 查询单个用户，返回完整信息（编号、姓名、邮箱、年龄）",
      "priority": "P1"
    },
    {
      "id": "REQ-002",
      "title": "用户列表过滤",
      "description": "查询用户列表，可选按最小年龄过滤",
      "priority": "P2"
    },
    {
      "id": "REQ-003",
      "title": "用户创建",
      "description": "创建新用户，返回系统分配的用户编号",
      "priority": "P1"
    },
    {
      "id": "REQ-004",
      "title": "用户信息更新与删除",
      "description": "按用户 ID 更新与删除用户",
      "priority": "P2"
    },
    {
      "id": "REQ-005",
      "title": "订单查询",
      "description": "订单按 ID 查询、按用户过滤、创建订单",
      "priority": "P1"
    }
  ]
}